{
  "simulationIdentity": {
    "name": "dipole2ghz",
    "identifier": "SIM_dipole2ghz",
    "description": "Electromagnetics simulation representation generated from HFSS extractor output."
  },
  "solver": {
    "name": "HFSS",
    "version": "ElectronicsDesktopStudent",
    "method": "FEM"
  },
  "geometry": {
    "entities": []
  },
  "mesh": {},
  "materials": [
    {
      "id": "air",
      "type": "dielectric",
      "properties": {}
    },
    {
      "id": "copper",
      "type": "conductor",
      "properties": {}
    },
    {
      "id": "vacuum",
      "type": "dielectric",
      "properties": {}
    }
  ],
  "ports": [],
  "boundaryConditions": [],
  "solverSettings": {
    "frequencyRange": {},
    "convergenceCriteria": {}
  },
  "results": {
    "sParameters": [],
    "fieldPlots": []
  },
  "provenance": {
    "sourceFiles": [
      "dipole2ghz.aedt"
    ],
    "timestamp": "2026-04-05T14:18:12+00:00"
  }
}